<?xml version="1.0" encoding="UTF-8"?>
<Persons xmlns="http://snegurskiy.it-academy.by/jd02_07/xml_class"
         xmlns:xsi="http://www.w3.org/2001/XMLSchema-instance"
         xsi:schemaLocation="http://snegurskiy.it-academy.by/jd02_07/xml_class ad.xsd">

        <Person>
            <Email>
                privet@mail.ru
            </Email>
            <Nickname>
                Dorohov
            </Nickname>
            <Password>
                qwerty
            </Password>
            <Ads>
                <Ad>
                    <Description>
                        квартира
                    </Description>
                    <Addres>
                        Минск, ул. Гикало, 12
                    </Addres>
                    <Flat>4</Flat>
                    <Flats>5</Flats>
                    <Price>50000</Price>
                    <Area>50</Area>
                </Ad>
                <Ad>
                    <Description>
                        квартира
                    </Description>
                    <Addres>
                        Минск, ул. Платонова, 12
                    </Addres>
                    <Flat>4</Flat>
                    <Flats>5</Flats>
                    <Price>55000</Price>
                    <Area>50</Area>
                </Ad>

            </Ads>


        </Person>


    </Persons>